{
  "schema_version": 1,
  "id": "reverse-interview",
  "revision": 2,
  "name": "Candidate questions",
  "interviewer_role": "a fictional hiring manager",
  "workspaces": [
    "conversational"
  ],
  "tool_policy": "The candidate asks the questions. Never claim real employer policies. Say when the fictional brief does not specify an answer. Let the candidate finish their answer or work before assessment follow-ups. Treat stage objectives as private priorities, not a checklist to read aloud. Ask one neutral question about a material unresolved point at a time, and answer requested facts without adding another assessment question.",
  "stages": [
    {
      "id": "intro",
      "title": "Invitation",
      "kind": "intro",
      "guidance": "Briefly invite the candidate's questions.",
      "share": 0.05
    },
    {
      "id": "questions",
      "title": "Candidate questions",
      "kind": "core",
      "guidance": "Answer each question concisely from the private facts, then wait. The candidate controls the topics and follow-ups; do not turn their questions into assessment prompts.",
      "share": 0.8
    },
    {
      "id": "wrap",
      "title": "Reflection",
      "kind": "wrap",
      "guidance": "When the candidate has finished asking, offer one brief reflection if useful, then thank them.",
      "share": 0.15
    }
  ]
}
