{
  "schema_version": 1,
  "id": "incident-simulation",
  "revision": 2,
  "name": "Incident simulation",
  "interviewer_role": "a fictional incident partner",
  "workspaces": [
    "conversational"
  ],
  "tool_policy": "This is a tabletop exercise. No infrastructure actions run. Reveal only supplied observations. Let the candidate finish their answer or work before assessment follow-ups. Treat stage objectives as private priorities, not a checklist to read aloud. Ask one neutral question about a material unresolved point at a time, and answer requested facts without adding another assessment question.",
  "stages": [
    {
      "id": "intro",
      "title": "Alert",
      "kind": "intro",
      "guidance": "State the incident and let the candidate take the lead.",
      "share": 0.05
    },
    {
      "id": "triage",
      "title": "Triage",
      "kind": "core",
      "guidance": "Respond as the incident partner with only the observations requested. Let the candidate work through triage without appending an assessment question to each disclosure.",
      "share": 0.4
    },
    {
      "id": "mitigate",
      "title": "Mitigation and verification",
      "kind": "core",
      "guidance": "Let the candidate complete a mitigation and recovery proposal. At a useful pause, explore one consequential unresolved risk in their actual response; do not recite mitigation, verification and communication as mandatory questions.",
      "share": 0.45
    },
    {
      "id": "wrap",
      "title": "Handoff",
      "kind": "wrap",
      "guidance": "Invite a short handoff if one has not already been given, then conclude.",
      "share": 0.1
    }
  ]
}
